{"run":69,"commit":"a318fe8","metric":1,"metrics":{},"status":"keep","description":"Semantic deduplication: detect repeated multi-line blocks and replace 2nd+ occurrences with [see §N] cross-references. Badrobots 18.58% (+1.67pp), Anthropic 19.61% (+1.39pp). Pass rate 100%.","timestamp":1784755986045,"segment":2,"confidence":null,"asi":{"hypothesis":"Replacing repeated multi-line blocks with cross-references saves significant bytes without losing semantic content","next_action_hint":"Consider extending dedup to handle single-line repeats and prose patterns. Or accept current state.","rollback_reason":null}}
{"run":70,"commit":"09dd7b0","metric":1,"metrics":{},"status":"keep","description":"Extend dedup to handle single-line repeats: repeated URLs, import statements, and other single-line patterns now get [see §N] references. Badrobots 19.93% (+1.35pp), Anthropic 20.31% (+0.70pp). Pass rate 100%.","timestamp":1784756209899,"segment":2,"confidence":null,"asi":{"hypothesis":"Extending dedup to single-line repeats catches repeated URLs, imports, and config lines that multi-line block dedup misses","next_action_hint":"Consider extending dedup to handle prose patterns that span across lines but aren't exact block matches. Or accept current state.","rollback_reason":null}}
{"run":71,"commit":"853083d","metric":1,"metrics":{},"status":"keep","description":"Extend dedup with similarity-based matching: blocks sharing 20+ char prefix now deduplicated. Badrobots 19.93%, Anthropic 20.31%, pass rate 100%.","timestamp":1784756359201,"segment":2,"confidence":null,"asi":{"hypothesis":"Similarity-based dedup catches repeated patterns with minor variations","next_action_hint":"Dedup is now comprehensive. All easy optimizations exhausted. Consider ending experiment loop.","rollback_reason":null}}
{"type":"config","name":"Fix three pipeline bugs: code→cd, URL protection, dedup section numbering","metricName":"pass_rate","metricUnit":"\"\"","bestDirection":"higher"}
{"run":72,"commit":"af91e38","metric":1,"metrics":{},"status":"keep","description":"Baseline: L2+grammar+dict on badrobots (115/115 = 100% pass rate, 21.8% savings, avg heading F1 0.992)","timestamp":1784838885427,"segment":3,"confidence":null,"asi":{"avg_heading_f1":0.992,"hypothesis":"Establish baseline for bug fix experiment session","savings_pct":21.8}}
{"run":73,"commit":"906b259","metric":1,"metrics":{},"status":"keep","description":"Fix 3 pipeline bugs: (1) code→cod (not cd), (2) URL protection in grammar strip (detects protocol:// and domain/path patterns), (3) dedup section numbering for L2 heading format. Savings 22.1% (+0.3pp), heading F1 0.993 (+0.001). Pass rate 100%.","timestamp":1784839266231,"segment":3,"confidence":null,"asi":{"avg_heading_f1":0.993,"delta_savings":0.3,"hypothesis":"Fix three pipeline bugs: code→cod, URL protection, dedup section numbering","savings_pct":22.1}}
{"run":74,"commit":"c03be30","metric":1,"metrics":{},"status":"keep","description":"Reverted MIN_OCCURRENCES=3 (caused gitignore/SKILL.md regression). Three bug fixes retained: code→cod, URL protection, dedup section numbering. Savings 21.9% (+0.1pp vs baseline 21.8%). Pass rate 100%.","timestamp":1784839576103,"segment":3,"confidence":null,"asi":{"avg_heading_f1":0.993,"delta_savings":0.1,"hypothesis":"MIN_OCCURRENCES=3 causes inline_code regression on gitignore/SKILL.md - reverted","savings_pct":21.9}}
{"run":75,"commit":"13b2bdc","metric":1,"metrics":{},"status":"keep","description":"Add 10 filler words to FREQUENCY_TABLE (also, so, then, here, there, still, always, now, too, such). Savings 22.8% (+0.9pp vs 21.9%). Pass rate 100%.","timestamp":1784839670632,"segment":3,"confidence":null,"asi":{"avg_heading_f1":0.993,"delta_savings":0.9,"hypothesis":"Adding common filler words to FREQUENCY_TABLE increases savings without breaking harness","savings_pct":22.8}}
{"run":76,"commit":"8cca31c","metric":1,"metrics":{},"status":"keep","description":"Add 6 safe filler words to FREQUENCY_TABLE (also, so, here, there, too, such). Removed temporal words (then, still, always, now) and quantifiers (per, every, many) per user feedback. Savings 22.9% (+1.0pp vs 21.9%). Pass rate 100%.","timestamp":1784839777474,"segment":3,"confidence":null,"asi":{"avg_heading_f1":0.993,"delta_savings":1,"hypothesis":"Adding safe non-temporal filler words increases savings without breaking harness","savings_pct":22.9}}
{"run":77,"commit":"b04ccd0","metric":1,"metrics":{},"status":"keep","description":"Fix duplicate ABBREV_MAP entry for code→cod (line 152 was still cd). Savings 22.5%, pass rate 100%.","timestamp":1784840107332,"segment":3,"confidence":null,"asi":{"avg_heading_f1":0.993,"hypothesis":"Fix ABBREV_MAP sync for code→cod","savings_pct":22.5}}
